{"$id":"https://in-the-loop.local/schemas/kg-rag/kg-rag-framework-manifest.schema.json","$schema":"https://json-schema.org/draft/2020-12/schema","additionalProperties":false,"properties":{"artifacts":{"items":{"additionalProperties":false,"properties":{"bytes":{"type":"integer"},"path":{"type":"string"},"sha256":{"type":"string"},"version":{"type":"string"}},"required":["path","bytes","sha256","version"],"type":"object"},"type":"array"},"capabilities":{"items":{"type":"string"},"type":"array"},"cookbook_version":{"type":"string"},"framework_id":{"type":"string"},"integrity_notice":{"type":"string"},"profiles":{"items":{"additionalProperties":false,"properties":{"allowed_routes":{"items":{"type":"string"},"type":"array"},"capabilities":{"items":{"type":"string"},"type":"array"},"maturity":{"type":"string"},"name":{"type":"string"},"network_policy":{"type":"string"},"required_adapters":{"items":{"type":"string"},"type":"array"}},"required":["name","maturity","network_policy","allowed_routes","capabilities","required_adapters"],"type":"object"},"type":"array"},"schema":{"type":"string"}},"required":["schema","framework_id","cookbook_version","integrity_notice","capabilities","profiles","artifacts"],"title":"kg-rag-framework-manifest","type":"object"}
