{"artifacts":[{"bytes":5816,"path":"kg-rag/source-ledger.json","sha256":"fe5c49abd49a4dc49312d0c11349d5f8cbb7667c6d55585cc0ec982c8cf19a73","version":"0.1.0"},{"bytes":7878,"path":"kg-rag/recipe-registry.json","sha256":"eec6c909651b6011ac78b594d36fce03044607667274436d2fcde280a900e223","version":"0.1.0"},{"bytes":1250,"path":"kg-rag/qualification.json","sha256":"3c3bdcce7d8c30adf454f96ed9548177e272ff039bead7bbce48315d47f5c492","version":"0.1.0"},{"bytes":350,"path":"kg-rag/ontology-plan.json","sha256":"f06c147bf64d7bd8eb329aa43d37186f13bb8c1e59ecba661527c85cde00bb9e","version":"0.1.0"},{"bytes":229,"path":"kg-rag/shapes-plan.json","sha256":"d6eb479ef980c44703deeabea99221dfb7fc399073fdc56baecb2050f20380d0","version":"0.1.0"},{"bytes":7124,"path":"schemas/kg-rag/kg-rag-blueprint.schema.json","sha256":"7f590925cdc4ca9c6823f09f05659e00ed792fe2d820f69238771767a281d4ec","version":"0.1.0"},{"bytes":1268,"path":"schemas/kg-rag/kg-rag-framework-manifest.schema.json","sha256":"8cfa52e33e4171efdb856a383bf2d0e895a615cbe6a99483500a0c284adbc6de","version":"0.1.0"},{"bytes":2059,"path":"schemas/kg-rag/kg-rag-harness-boot-receipt.schema.json","sha256":"4f7ea9e23131cceab5a8cf4f44f3f3b448a27040173f1fe639ee6c13ce200c63","version":"0.1.0"},{"bytes":1343,"path":"schemas/kg-rag/kg-rag-qualification.schema.json","sha256":"21eb28561a922630802f7decefd162fdabd3677725c7c3888818846213204f35","version":"0.1.0"},{"bytes":1041,"path":"schemas/kg-rag/kg-rag-recipe-registry.schema.json","sha256":"7fd07c7aabd53c06530872c14dbdd6583b3844c7c000e115b6d8690dddf818c9","version":"0.1.0"},{"bytes":2253,"path":"schemas/kg-rag/kg-rag-source-ledger.schema.json","sha256":"db8f9e96132da8a3ca1bc23fe9b41f2ad07cdbd82248cefe3b9c549c6b932b52","version":"0.1.0"},{"bytes":585,"path":"schemas/kg-rag/ngf-document.schema.json","sha256":"e687150f4e19db6059b72a2199f5c44114afd36f2c837e5a354f7f5426bb2d8a","version":"0.1.0"},{"bytes":8383,"path":"fixtures/kg-rag/valid/call-e-blocked.json","sha256":"d674edead5453290f27cd448b702a8d32921558a271f59b15e0adecee4bab9ac","version":"0.1.0"},{"bytes":8475,"path":"fixtures/kg-rag/valid/local-deterministic.json","sha256":"e137253c94de072192871c253c6019314edc6b726ab320f9c4d7fb0c9863b147","version":"0.1.0"},{"bytes":8411,"path":"fixtures/kg-rag/valid/production-adapter.json","sha256":"631592b153d5ddd3da90dc42a3af6d4fa2401710c21f2007476099e8f15edbcd","version":"0.1.0"}],"capabilities":["canonical-json-graph","canonical-jsonl-vector","offline-validation","lexical-baseline","source-ledger","ontology-shapes","entity-relation-extraction","entity-resolution","graph-construction","vector-indexing","query-classification","bounded-graph-traversal","community-global-retrieval","hybrid-fusion","reranking","evidence-packet-assembly","cited-answering","contradiction-handling","abstention","update-deletion-reindexing","adversarial-evaluation","cost-observability"],"cookbook_version":"0.1.0","framework_id":"itl-kg-rag-cookbook","integrity_notice":"Artifact digests prove exact local bytes, not provenance, truth, or runtime readiness.","profiles":[{"allowed_routes":["local-hybrid"],"capabilities":["canonical-json-graph","canonical-jsonl-vector","offline-validation","lexical-baseline","source-ledger","ontology-shapes","entity-relation-extraction","entity-resolution","graph-construction","vector-indexing","query-classification","bounded-graph-traversal","community-global-retrieval","hybrid-fusion","reranking","evidence-packet-assembly","cited-answering","contradiction-handling","abstention","update-deletion-reindexing","adversarial-evaluation","cost-observability"],"maturity":"blueprint","name":"local-deterministic","network_policy":"forbidden","required_adapters":["graph_store","vector_index","lexical_index","embedder","reranker","answerer","observability"]},{"allowed_routes":["production-hybrid"],"capabilities":["canonical-json-graph","canonical-jsonl-vector","offline-validation","lexical-baseline","source-ledger","ontology-shapes","entity-relation-extraction","entity-resolution","graph-construction","vector-indexing","query-classification","bounded-graph-traversal","community-global-retrieval","hybrid-fusion","reranking","evidence-packet-assembly","cited-answering","contradiction-handling","abstention","update-deletion-reindexing","adversarial-evaluation","cost-observability"],"maturity":"abstract","name":"production-adapter","network_policy":"forbidden","required_adapters":["graph_store","vector_index","lexical_index","embedder","reranker","answerer","observability"]},{"allowed_routes":["call-e"],"capabilities":["canonical-json-graph","canonical-jsonl-vector","offline-validation","lexical-baseline","source-ledger","ontology-shapes","entity-relation-extraction","entity-resolution","graph-construction","vector-indexing","query-classification","bounded-graph-traversal","community-global-retrieval","hybrid-fusion","reranking","evidence-packet-assembly","cited-answering","contradiction-handling","abstention","update-deletion-reindexing","adversarial-evaluation","cost-observability"],"maturity":"blocked","name":"call-e","network_policy":"forbidden","required_adapters":["graph_store","vector_index","lexical_index","embedder","reranker","answerer","observability"]}],"schema":"kg-rag-framework-manifest/1.0"}
